ID;Nombre_distribuidor;Direccion
1;Balcarce 54 -Centro-;Balcarce 54, Rosario, Santa F‚, Argentina
2;Balcarce 54 -Circunvalaci¢n-;Circunvalaci¢n Y J. J. Paso, Rosario, Santa F‚, Argentina
3;Bercovich -24 de Septiembre-;24 de Septiembre 744, San Miguel de Tucum n, Tucum n, Argentina
4;Bercovich -Amador Lucero-;Amador Lucero esq. Crisologo Alvarez, San Miguel de Tucum n, Tucum n, Argentina
5;Bercovich -Concepci¢n-;Espa¤a 631, Concepci¢n, Tucum n, Argentina
6;Bercovich -Yerba Buena-;Aconquija esq. Solano Vera, Yerba Buena, Tucum n, Argentina
7;Blaisten -Escobar-;Panamericana y Ruta 25 Portal Escobar, Escobar, Buenos Aires, Argentina
8;Blaisten -Floresta-;Av. Juan Bautista Alverdi 3928, Capital Federal, Buenos Aires, Argentina
9;Blaisten -Martinez-;Av. Fondo de la Legua 1530, Martinez, Buenos Aires, Argentina
10;Blaisten -Palermo-;Av. Juan B. Justo 1380, Capital Federal, Buenos Aires, Argentina
11;Blaisten -Pilar-;Panamericana Ramal Pilar km 50 Las Palmas Pilar, Pilar, Buenos Aires, Argentina
12;Bosch & Cia. -Montevideo-;Av. Rivera 2560, Montevideo, Uruguay
13;Bosch & Cia. -Punta del Este-;Av. Espa¤a Pda. 27, Punta del Este, Uruguay
14;Casaterra -Fiserton-;Av. Eva Per¢n 7650, Rosario, Santa F‚, Argentina
15;Casaterra -Oro¤o-;Oro¤o 4295, Rosario, Santa F‚, Argentina
16;Ceramisur -Berazategui-;Av. Vergara 2320, Berazategui, Buenos Aires, Argentina
17;Ceramisur -Florencio Varela-;Av. San Mart¡n 2544, Florencio Varela, Buenos Aires, Argentina
18;Cerrosud -Constituci¢n-;Av. Constituci¢n 4232, Mar del Plata, Buenos Aires, Argentina
19;Cerrosud -Juan B. Justo-;Av. Juan B. Justo 2571, Mar del Plata, Buenos Aires, Argentina
20;Cesar Di Cesare;Av. Del Valle 6048, Olavarria, Buenos Aires, Argentina
21;Cisilotto Hnos;Av. Gaona 11001 Acceso Oeste, La Reja, Buenos Aires, Argentina
22;Comar Design -Casa Central-;Brown 1565, Bahia Blanca, Buenos Aires, Argentina
23;Comar Design -Centro-;Alvarado 17, Bahia Blanca, Buenos Aires, Argentina
24;Construcciones del Oeste;Acceso Sur 2540, Gualeguaychu, Entre R¡os, Argentina
25;Darsie -Casa Central-;General Alvear 762, C¢rdoba Capital, C¢rdoba, Argentina
26;Darsie -Hiper Construcci¢n-;Fray Luis Beltrab y M. Carde¤osa, C¢rdoba Capital, C¢rdoba, Argentina
27;Darsie -Molinos-;Av. Velez Sarsfield 3893, Parque los Molinos, C¢rdoba, Argentina
28;Domus;Av. Pellegrini 1802, Rosario, Santa F‚, Argentina
29;El‚ctrica Boia;Alferez Pacheco 842, Zarate, Buenos Aires, Argentina
30;Elete Cer micos;Calle 9 n 1050, General Pico, La Pampa, Argentina
31;Estructurales Ranquel SRL;Blvd. Obispo Leopoldo Buteler 27, R¡o Cuarto, C¢rdoba, Argentina
32;Familia Bercomat;Av. Juan Bautista Alverdi 3765, Capital Federal, Buenos Aires, Argentina
33;Familia Bercomat;Au. Panamericana km 25,4, Don Torcuato, Buenos Aires, Argentina
34;Fedan;Av. Mitre, Quilmes, Buenos Aires, Argentina
35;Foschia -Casa Central-;Ruta 197 y Panamericana, El Talar, Buenos Aires, Argentina
36;Foschia -Zarate-;Av. Lavalle 1201, Zarate, Buenos Aires, Argentina
37;Herrajes Galo;Av. Del Libertador 6545, Capital Federal, Buenos Aires, Argentina
38;Hiperceramico -Arga-;Acceso Este y Arturo Gonzalez, Maipu, Mendoza, Argentina
39;Hiperceramico -Casa Central-;Av. Acceso Norte y Manuel A. S enz, Las Heras, Mendoza, Argentina
40;Hiperceramico -San Juan-;Av. Ignacio de la Roza, San Juan Capital, San Juan, Argentina
41;Hiperceramico -San Luis-;RP3 km 1, San Luis Capital, San Luis, Argentina
42;Interiores Casilda;Blvd. 9 de Julio 2246, Casilda, Santa F‚, Argentina
43;Ladrillos Merlino -Carlos Paz I-;Av. San Mart¡n 1255, Villa Carlos Paz, C¢rdoba, Argentina
44;Ladrillos Merlino -Carlos Paz II-;Av. San Mart¡n 1771, Villa Carlos Paz, C¢rdoba, Argentina
45;Ladrillos Merlino -C¢rdoba I-;Av. Fuerza Aerea 2934, C¢rdoba Capital, C¢rdoba, Argentina
46;Ladrillos Merlino -C¢rdoba II-;Av. Circunvalaci¢n Agust¡n Tosco 4460, C¢rdoba Capital, C¢rdoba, Argentina
47;Mas Ferreter¡a;Dr Juan Jos‚ Paso 970, General Villegas, Buenos Aires, Argentina
48;Mosaicos Chajar¡;Mitre 1755, Chajar¡, Entre R¡os, Argentina
49;Mosaicos Lenzi -Pergamino-;Av. Hip¢lito Yrigoyen 1078, Pergamino, Buenos Aires, Argentina
50;Mosaicos Lenzi -San Nicolas-;Av. Alverdi 468, San Nicolas, Buenos Aires, Argentina
51;Mosaicos Lenzi -Villa Constituci¢n-;Venecia 719, Villa Constituci¢n, Santa F‚, Argentina
52;Neostone;Santiago Eichhorn 419, Crespo, Entre R¡os, Argentina
53;Nimat;Av. Monse¤or Tavella 1937, Concordia, Entre R¡os, Argentina
54;Nueva Casa -Benavidez-;Av. Agust¡n M. Garcia 11089, Benavidez, Buenos Aires, Argentina
55;Nueva Casa -Escobar-;Av. General San Mart¡n 1987, Escobar, Buenos Aires, Argentina
56;Nueva Casa -Pilar-;Panamericana km 46,6 Acceso Pilar, Pilar, Buenos Aires, Argentina
57;Qubo Ambientes;Av. Sarmiento 2599, Resistencia, Corrientes, Argentina
58;Revestir;Av. Centenario 939, San Isidro, Buenos Aires, Argentina
59;Sa. Go. Sa.;Av. Polonia 598, Comodoro Rivadavia, Chubut, Argentina
60;Sakura -Casa Centrla-;Gral. Jos‚ de San Mart¡n 2626, Neuqu‚n Capital, Neuqu‚n, Argentina
61;Sakura -Cipolletti-;25 de Mayo esq. Fernandez Oro, Cipolletti, R¡o Negro, Argentina
62;Sakura -Express-;Mascardi 51, Neuqu‚n Capital, Neuqu‚n, Argentina
63;Sakura -General Roca-;Bolivia 649, General Roca, R¡o Negro, Argentina
64;Todo Sanitarios;Libertad 1945, San Francisco, C¢rdoba, Argentina
65;Vs Deco -Trelew-;Hip¢lito Yrigoyen 1219, Trelew, Chubut, Argentina
66;Vs Deco -Puerto Madrin-;9 de Julio 274, Puerto Madrin, Chubut, Argentina
